<?xml-stylesheet type="text/css" href="Student.css" ?>
<!DOCTYPE student SYSTEM "student.dtd">
<students>
    <student>
        <id>1</id>
        <name>Eeshwar</name>
        <email>ematuru@gitam.in</email>
        <Phone>9346769679</Phone>
        <age>20</age>
        <grade>A+</grade>
    </student>
    <student>
        <id>2</id>
        <name>Keerthi</name>
        <email>keerthi@gitam.in</email>
        <Phone>9753689653</Phone>
        <age>20</age>
        <grade>A+</grade>
    </student>
    <student>
        <id>3</id>
        <name>Siddarth</name>
        <email>devara@gitam.in</email>
        <Phone>8765808647</Phone>
        <age>20</age>
        <grade>B</grade>
    </student>
    <student>
        <id>4</id>
        <name>Shreya</name>
        <email>Shreya@gitam.in</email>
        <Phone>9753567975</Phone>
        <age>20</age>
        <grade>A</grade>
    </student>
    <student>
        <id>5</id>
        <name>Lalith</name>
        <email>Lalith@gitam.in</email>
        <Phone>9463846382</Phone>
        <age>19</age>
        <grade>B+</grade>
    </student>
    <student>
        <id>6</id>
        <name>Amith</name>
        <email>amith@gitam.in</email>
        <Phone>9265828463</Phone>
        <age>19</age>
        <grade>B+</grade>
    </student>
</students>
